id|title|text|date
11|How Companies Are Working To Reduce The Size of Their Carbon Footprint|['“Scientific evidence for warming of the climate system is unequivocal.” ~ Intergovernmental Panel on Climate Change', 'The Earth’s natural greenhouse continues to change. Over the years, the concentration of greenhouse gases (GHG) in the atmosphere has increased, resulting in catastrophic changes in the climate. July 2019 was the warmest month in\xa0', '\xa0history for the globe. The GHG emissions are traced in the form of a carbon footprint, which is the total amount of GHG generated by human activities.', 'Here’s a look at how these GHG emissions are at the country level and how are corporates are committing to lower their carbon footprint.', 'At the\xa0', ', China is the largest contributor to CO', '\xa0emissions with 28% (10.06GT) followed by the U.S. at 15% (5.41GT), India at 7% (2.65GT), and Russia at 5% (1.71GT). However, in terms of per capita emissions, Saudi Arabia is the largest emitter with 18.48T of per capital emissions,\xa0followed by Kazakhstan, Australia, the U.S., Canada, and South Korea at 17.6T, 16.92T, 16.56T, 15.32T, and 12.89T, respectively.', 'According to the U.S. Energy Information Administration, the burning of fossil fuels was responsible for\xa076% of U.S. greenhouse gas emissions. Fossil fuels were the\xa0', '\xa0of about 75% of total U.S. anthropogenic greenhouse gas emissions in 2018.', 'One landmark environmental\xa0', '\xa0towards cutting emissions was the Paris Agreement signed by nearly every nation to address\xa0climate change\xa0and its negative impacts. The deal aims to substantially reduce global greenhouse gas emissions and includes\xa0commitments from all major emitting countries\xa0to cut their climate-altering pollution.\xa0As climate change and sustainability take center stage, many companies have set emission reduction targets for the next five, ten, twenty, and thirty years.', 'For the last ten years,\xa0', '\xa0has made significant investments to reduce its historic carbon footprint.\xa0In January 2020, they\xa0', '\xa0their goal to be carbon negative by 2030, and ultimately remove its carbon footprint (has emitted either directly or by electrical consumption) since it was founded in 1975 by 2050.', '\xa0has been making efforts to reduce CO', '\xa0emissions and ensure sustainability over the years. The company has\xa0', '\xa0set new targets for the phase up to 2030. It includes the first-ever CO', '\xa0goals for full lifecycle up to 2030 and lowering of carbon emissions from production and sites by 80% per vehicle.', 'In July 2020,\xa0', '\xa0unveiled its plan to become carbon neutral across its entire business, which will ensure that every Apple device sold by 2030 will have a net zero climate impact. Apple has set a\xa0', '\xa0to reduce emissions by 75% by 2030 while developing innovative carbon removal solutions for the remaining 25% of its footprint.', 'In June,\xa0', '\xa0', '\xa0its first long-term wind energy power purchase agreement (PPA) as a part of its overall strategy to move towards renewable energy. Cisco is aiming\xa0at a 85% renewable energy target by 2022 along with a 60% GHG reduction.', '\xa0has\xa0', '\xa0a 39.7%\xa0reduction in operational CO', '\xa0emissions since 2005. This puts IBM well ahead of\xa0', '\xa0in reaching its current goal of a 40% reduction in CO', '\xa0emissions by 2025. The company plans to source 55% of its electricity from renewables by 2025.', 'In January,\xa0', '\xa0', '\xa0that it has met its carbon neutrality goal a year ahead of schedule.\xa0', '\xa0', '\xa0its plans to reduce carbon emissions by 50% by 2030.', '\xa0set a goal\xa0to run its sites and deliver its products with 100% renewable energy by 2035, without the use of carbon offsets or unbundled renewable energy credits.\xa0', '\xa0', '\xa0a 59% reduction in operational GHG emissions\xa0in 2019 compared to 2017 levels, and is on its way to achieve its target of 75% emissions reduction by the end of 2020.', '\xa0set a\xa0', '\xa0to reach net zero carbon across its ecosystem by 2040. During 2019, Amazon witnessed a 22% increase in net sales while its total carbon footprint increased by 15%. While the e-commerce giant has been making investments in solar energy and electric vehicles, it has further\xa0', '\xa0$2 billion in June 2020 under its Climate Pledge Fund to invest in companies, which will facilitate the transition to a low-carbon economy.', 'Back in 2017,\xa0', '\xa0became the\xa0', '\xa0company of its size to\xa0match its entire annual electricity consumption\xa0with renewable energy. Today, Google is the largest corporate buyer of renewable energy in the world.', '\xa0aims to reduce its net emissions by 50% by 2020 compared to a 2012 baseline. Disney recently\xa0', '\xa0a new solar facility, which will generate enough power to operate two theme parks in Orlando. It will equate to reducing annual GHG emissions by more than 52,000 metric tons.', 'Over the years,\xa0', '\xa0has addressed climate change by increasing use of green power to 71% globally and reducing its direct carbon emissions by 39% on an intensity basis from a 2010 baseline.\xa0The company\xa0', '\xa0for 100% renewable energy use by 2030.', 'The initiatives towards reducing carbon footprint and climate change cannot show overnight results. However, these efforts can go a long way in ensuring the sustainability of our planet. In the words of Robert Swan OBE, “The greatest threat to our planet is the belief that someone else will save it.”\xa0', 'The views and opinions expressed herein are the views and opinions of the author and do not necessarily reflect those of Nasdaq, Inc.', 'Prableen Bajpai is the founder of FinFix Research and Analytics which is an all women financial research and wealth management firm. She holds a bachelor (honours) and master’s degree in economics with a major in econometrics and macroeconomics. Prableen is a Chartered Financial Analyst (CFA, ICFAI) and a CFP®.']|None
12|IBM Unveils POWER10 Processor|[' ', " doesn't ", ' anymore, instead relying on third-party foundries to build its POWER server chips. The company revealed its latest POWER processor on Monday, aimed squarely at hybrid cloud and artificial intelligence.', "IBM's POWER10 processor won't be available in systems until the second half of 2021, but when it arrives it will provide substantial improvements over the ", '. IBM has tapped ', ' to manufacture the chips using a 7nm process. POWER9 processors, launched in late 2017, used a 14nm manufacturing process.', 'Image source: IBM.', "The move to a 7nm process will boost the efficiency of IBM's POWER10 chips. The company expects POWER10 to provide as much as a threefold improvement in energy efficiency per socket, allowing systems built with the chip to support three times as many users, workloads, and containers for hybrid cloud workloads.", 'IBM has bet big on hybrid cloud computing, ', " in a $34 billion deal. The POWER10 chip is optimized for Red Hat's OpenShift platform, playing into IBM's strategy of selling its existing customers on Red Hat's products. IBM has said that for every 5% of its base of large clients with little to no Red Hat spend, there's a ", ' in getting those customers to buy into the Red Hat ecosystem.', '"With our stated goal of making Red Hat OpenShift the default choice for hybrid cloud, IBM POWER10 brings hardware-based capacity and security enhancements for containers to the IT infrastructure level," said Stephen Leonard, GM of IBM Cognitive Systems, in the press release announcing the POWER10 chip.', 'Artificial intelligence is another type of workload IBM is targeting with its POWER10 chip. The chip includes specialized hardware to accelerate AI inference, with IBM promising big improvements in AI performance compared to the POWER9 chip. POWER10 will delivery anywhere from a ten- to twentyfold jump in AI inference performance, depending on the type of calculation.', 'Security is also a selling point of the POWER10 chip. The POWER10 has four times as much hardware dedicated to encryption compared to the POWER9, providing significantly faster encryption performance.', 'While servers built using x86 processors from ', ' or increasingly ', " dominate the market, IBM still has a major presence. IBM was the no. 5 server manufacturer in the first quarter of 2020, generating nearly $900 million of revenue and claiming around 5% of the market, according to IDC. Those numbers don't include sales from a joint venture with Chinese company Inspur to manufacture and sell POWER systems. That joint venture generated over $1.3 billion of sales in the first quarter, claiming 7.1% of the market.", "IBM's POWER systems represent a minority of the server market, but the company's base of POWER users provides an opportunity to boost adoption of Red Hat software, and the company's base of Red Hat users provides an opportunity to sell those customers on POWER systems.", "The pandemic is probably hurting sales of IBM's hardware as IT budgets are cut. That pain will last a while, but things may be close to normal by the second half of 2021 when POWER10 systems become available. While IBM will probably fail to grow its revenue this year due to the pandemic, 2021 could be a different story.", 'When investing geniuses David and Tom Gardner have a stock tip, it can pay to listen. After all, the newsletter they have run for over a decade, ', ', has tripled the market.*', 'David and Tom just revealed what they believe are the ', " for investors to buy right now... and IBM wasn't one of them! That's right -- they think these 10 stocks are even better buys.", '\xa0', '\xa0', 'The views and opinions expressed herein are the views and opinions of the author and do not necessarily reflect those of Nasdaq, Inc.', "Founded in 1993 in Alexandria, VA., by brothers David and Tom Gardner, The Motley Fool is a multimedia financial-services company dedicated to building the world's greatest investment community. Reaching millions of people each month through its website, books, newspaper column, radio show, television appearances, and subscription newsletter services, The Motley Fool champions shareholder values and advocates tirelessly for the individual investor. The company's name was taken from Shakespeare, whose wise fools both instructed and amused, and could speak the truth to the king -- without getting their heads lopped off."]|None
13|April 2021 Options Now Available For International Business Machines |['Investors in International Business Machines Corp (Symbol: IBM) saw new options begin trading today, for the April 2021 expiration.  One of the key data points that goes into the price an option buyer is willing to pay, is the time value, so with 239 days until expiration the newly trading contracts represent a potential opportunity for sellers of puts or calls to achieve a higher premium than would be available for the contracts with a closer expiration.   At ', ', our YieldBoost formula has looked up and down the IBM options chain for the new April 2021 contracts and identified one put and one call contract of particular interest.', 'The put contract at the $120.00 strike price has a current bid of $9.60.  If an investor was to sell-to-open that put contract, they are committing to purchase the stock at $120.00, but will also collect the premium, putting the cost basis of the shares at $110.40 (before broker commissions).  To an investor already interested in purchasing shares of IBM, that could represent an attractive alternative to paying $123.80/share today.\n\n', 'Because the $120.00 strike represents an approximate 3% discount to the current trading price of the stock (in other words it is out-of-the-money by that percentage), there is also the possibility that the put contract would expire worthless.  The current analytical data (including greeks and implied greeks) suggest the current odds of that happening are 100%.  Stock Options Channel will track those odds over time to see how they change, publishing a chart of those numbers on our website under the ', '.  Should the contract expire worthless, the premium would represent a 8.00% return on the cash commitment, or 12.22% annualized — at Stock Options Channel we call this the YieldBoost.\n\n\n', 'Below is a chart showing the trailing twelve month trading history for International Business Machines Corp, and highlighting in green where the $120.00 strike is located relative to that history:\n\n', '\n   ', 'Turning to the calls side of the option chain, the call contract at the $125.00 strike price has a current bid of $7.95.  If an investor was to purchase shares of IBM stock at the current price level of $123.80/share, and then sell-to-open that call contract as a "covered call," they are committing to sell the stock at $125.00.  Considering the call seller will also collect the premium, that would drive a total return (excluding dividends, if any) of 7.39% if the stock gets called away at the April 2021 expiration (before broker commissions).  Of course, a lot of upside could potentially be left on the table if IBM shares really soar, which is why looking at the trailing twelve month trading history for International Business Machines Corp, as well as studying the business fundamentals becomes important.   Below is a chart showing IBM\'s trailing twelve month trading history, with the $125.00 strike highlighted in red:\n\n\n', '\n   ', '\nConsidering the fact that the $125.00 strike represents an approximate 1% premium to the current trading price of the stock (in other words it is out-of-the-money by that percentage), there is also the possibility that the covered call contract would expire worthless, in which case the investor would keep both their shares of stock and the premium collected.  The current analytical data (including greeks and implied greeks) suggest the current odds of that happening are 99%.  On our website under the ', ', Stock Options Channel will track those odds over time to see how they change and publish a chart of those numbers (the trading history of the option contract will also be charted).   Should the covered call contract expire worthless, the premium would represent a 6.42% boost of extra return to the investor, or 9.81% annualized, which we refer to as the YieldBoost.\n\n\n', "Meanwhile, we calculate the actual trailing twelve month volatility (considering the last 252 trading day closing values as well as today's price of $123.80) to be 39%.  For more put and call options contract ideas worth looking at, visit StockOptionsChannel.com.", '\n', '\n', 'The views and opinions expressed herein are the views and opinions of the author and do not necessarily reflect those of Nasdaq, Inc.']|None
14|Why Anaplan Shares Are Soaring Today|['Shares of ', ' ', ' soared as much as 30.4% higher on Wednesday morning, following a strong second-quarter earnings report.', "Anaplan's sales rose 26% year over year to $106.5 million. Adjusted bottom-line losses decreased from $0.12 to $0.04 per diluted share. Your average analyst had expected a net loss of $0.12 per share on revenues near $103.5 million.", 'The provider of cloud-based business planning tools and services also set a third-quarter revenue target at approximately $110 million, well ahead of the Street consensus at $108 million.', 'Image source: Getty Images.', 'Anaplan saw a strong interest in its business planning services from large enterprises during the COVID-19 health crisis. In the ', ', CEO Frank Calderoni highlighted big contract wins with massive companies in the retail, healthcare, and technology sectors.', '"What stands out to me is the rapid change that the global pandemic has forced upon businesses. This endless pace of change has become unrelenting, and the need for a connected platform is playing out," Calderoni said. "Customers are choosing us because of the value that they see in the platform."', "We're looking at ", " here, exploring a large target market under highly qualified leadership. Don't forget that Calderoni served as the CFO of networking giant ", ' ', ' for more than a decade before ', ' by ', ' ', '. This guy sure knows his way around enterprise-class business deals.', "The stock is nearly back to February's all-time highs again, having posted a 137% bounce from the market bottom in March.", 'When investing geniuses David and Tom Gardner have a stock tip, it can pay to listen. After all, the newsletter they have run for over a decade, ', ', has tripled the market.*', 'David and Tom just revealed what they believe are the ', " for investors to buy right now... and Anaplan Inc wasn't one of them! That's right -- they think these 10 stocks are even better buys.", '\xa0', '\xa0', 'The views and opinions expressed herein are the views and opinions of the author and do not necessarily reflect those of Nasdaq, Inc.', "Founded in 1993 in Alexandria, VA., by brothers David and Tom Gardner, The Motley Fool is a multimedia financial-services company dedicated to building the world's greatest investment community. Reaching millions of people each month through its website, books, newspaper column, radio show, television appearances, and subscription newsletter services, The Motley Fool champions shareholder values and advocates tirelessly for the individual investor. The company's name was taken from Shakespeare, whose wise fools both instructed and amused, and could speak the truth to the king -- without getting their heads lopped off."]|None
15|Better Buy: IBM vs. Oracle|[' and ', ' both struggled to pivot their legacy businesses toward the higher-growth cloud market over the past few years.', "IBM was weighed down by its legacy business software, hardware, and IT services segments. Former CEO Ginni Rometty divested Big Blue's slower-growth businesses and expanded its cloud ecosystem by acquiring big players like SoftLayer and ", ' -- but its growth remained sluggish.', 'Oracle transformed its on-premise database software into cloud-based services and expanded its ecosystem by\xa0buying NetSuite in 2016, but its growth remained anemic. Oracle ', ' the exact growth rates of its cloud services two years ago, and co-CEO Mark Hurd -- who led that cloud transformation -- passed away last year.', 'Image source: Getty Images.', 'I compared IBM and Oracle ', ", and declared that Big Blue's expansion plans, more disciplined buybacks, and higher dividend made it the better buy. However, Oracle's stock slightly outperformed IBM since I made that call, so it's time to take a fresh look at both stocks.", "IBM's revenue declined 3% to $77.1 billion (but stayed roughly flat after excluding divested businesses and currency impacts) last\xa0year. Within that total, its cloud revenue rose 11% (14% on an adjusted basis) to $21.2 billion. Its adjusted earnings declined 7%.", "Throughout the year, the growth of IBM's cloud and cognitive software and global business services units was offset by the weakness of its global technology, hardware systems, and global financing units. However, its acquisition of Red Hat, which closed last July, buoyed its revenue growth in the second half of the year.", "In the first half of\xa02020, IBM's revenue fell 4% to $35.7 billion. Its cloud and cognitive software revenues grew, thanks to Red Hat, as mainframe upgrades boosted its system sales. Unfortunately, COVID-19 disruptions offset those gains by reducing its technology, business services, and financing revenues, and its adjusted earnings tumbled 26%.", "IBM didn't provide any\xa0guidance for the full year, but analysts expect its revenue and earnings to decline 4% and\xa014%, respectively. Despite those challenges, IBM's CEO Arvind Krishna, who previously led the cloud and cognitive unit before ", ' earlier this year, expects Big Blue to generate fresh revenue growth from the ', " market with a blend of Red Hat's and IBM's services.", "IBM's hybrid cloud expansion boosted its adjusted cloud revenues 34% annually in the second quarter -- accelerating from its 23% growth in the first quarter -- but still couldn't offset the weakness of its older businesses. However, that balance could shift after the pandemic passes.", "Oracle's revenue declined 1% to $39.1 billion (and remained flat on a constant currency basis) in fiscal 2020, which ended on May 31.", 'Its stable growth in cloud services and license support revenues, which accounted for 70% of its top line, was offset by a sharp drop in its cloud license and on-premise license revenues. However, aggressive buybacks boosted its adjusted earnings 9%.', 'Oracle spent more than 100% of its ', ' (FCF) on buybacks over the past 12 months. By comparison, IBM spent just 4% of its FCF on buybacks during the same period. As a result, the bears often accuse Oracle of "buying" ', ' without growing its revenues.', 'Image source: Getty Images.', 'But there are ', ' on the horizon. Oracle\'s NetSuite ERP (enterprise resource planning) and Fusion HCM (human capital management) apps continue to generate double-digit revenue growth while reducing its dependence on its older database services, and it expects its revenue growth to "accelerate" after the pandemic ends. During last quarter\'s ', ', CEO Safra Catz declared that Oracle\'s "mix of business is becoming increasingly favorable" as its "growing" businesses become larger than its "declining" ones.', "In the first quarter of 2020, Oracle expects its reported revenue to stay flat and for its adjusted earnings to grow 5% to 9%. Oracle also didn't offer any guidance for the full year, but analysts expect its revenue to stay roughly flat and its earnings to rise 5%.", "IBM trades at just 11 times forward earnings, while Oracle has a slightly higher forward price-to-earnings (P/E) ratio of 14. Both stocks are fundamentally cheap because investors aren't expecting much growth.", 'However, IBM became a ', ' of the ', " earlier this year with its 25th consecutive dividend hike, and it currently pays a hefty forward dividend yield of 5.3%. Oracle pays a much lower forward yield of 1.4%, and it hasn't raised its dividend in over a year.", 'IBM and Oracle both want the growth of their newer businesses to offset the slowdown of their older ones.', "Oracle's near-term growth looks more stable than IBM's, but Krishna could breathe fresh life into IBM by beefing up its hybrid cloud and AI offerings. I'm less excited about Oracle's plans under Katz, who has led the company for nearly six years with little progress in growing its revenues.", "IBM's higher yield and lower valuation should satisfy investors until Krishna's strategies start bearing fruit. Therefore, I'd rather stick with IBM instead of Oracle, which doesn't offer investors enough compelling reasons to stick around.", 'When investing geniuses David and Tom Gardner have a stock tip, it can pay to listen. After all, the newsletter they have run for over a decade, ', ', has tripled the market.*', 'David and Tom just revealed what they believe are the ', " for investors to buy right now... and IBM wasn't one of them! That's right -- they think these 10 stocks are even better buys.", '\xa0', '\xa0', 'The views and opinions expressed herein are the views and opinions of the author and do not necessarily reflect those of Nasdaq, Inc.', "Founded in 1993 in Alexandria, VA., by brothers David and Tom Gardner, The Motley Fool is a multimedia financial-services company dedicated to building the world's greatest investment community. Reaching millions of people each month through its website, books, newspaper column, radio show, television appearances, and subscription newsletter services, The Motley Fool champions shareholder values and advocates tirelessly for the individual investor. The company's name was taken from Shakespeare, whose wise fools both instructed and amused, and could speak the truth to the king -- without getting their heads lopped off."]|None
