id|title|text|date
1|Is Accenture Stock a Buy?|[' ', ", which provides information technology (IT) and consulting services to a wide range of industries, has fared better than many industry peers over the past five years. Its stock has advanced over 150% in that time as it's acquired dozens of smaller companies, pivoted away from slower-growth markets, and expanded its reach across the higher-growth digital, cloud, and security markets.", "Accenture's stock dipped briefly in March during the COVID-19 crash, but it's now trading near its all-time highs again. Let's take a closer look at this IT services giant and see if its stock still has room to run.", 'Image source: Getty Images.', 'Accenture generated 55% of its revenue from technology services last year. Another 32% came from its strategy and consulting services, and the remaining 14% came from its operations business, which helps companies optimize their business operations.', 'It serves five end markets: product makers (28% of its revenue last year), ', ', media, and technology companies (20%), financial services (20%), health and public services (17%), and natural and chemical resources (16%). All five markets generated positive sales growth last year, led by an 18% year-over-year jump in the resources business.', 'Accenture\'s sprawling business includes a lot of moving parts, but its main strategy is to pivot away from slower-growth markets and toward the "new" digital, cloud, and security markets. Revenue from those new businesses grew 20% in constant currency terms last year and accounted for approximately 65% of its revenue -- up from just 40% in 2016.', 'The growth of those newer businesses, along with a steady stream of acquisitions and disciplined cost-cutting measures, enabled Accenture to generate robust revenue and earnings growth over the past five years:', 'Source: ', 'Last year, its revenue rose 5% (8.5% in constant currency terms) as its adjusted EPS grew 9%. In the first three quarters of fiscal 2020, its revenue grew another 4% (6% in constant currency terms) as its adjusted earnings rose 5%. For the full year, Accenture expects its revenue to rise 3.5% to 4.5% in constant currency terms, for its operating margin to expand, and for its adjusted earnings to rise 3% to 5%.', 'By comparison, ', "'s ", ' global business services revenue stayed nearly flat\xa0last year and its global technology services revenue dropped 6%. IBM is also attempting to pivot its aging IT and consulting services toward higher-growth markets, but its transformation has been far ', " than Accenture's.", "The COVID-19 crisis didn't significantly impact Accenture for two reasons. First, companies still needed to maintain their IT infrastructure throughout the pandemic, and accelerating demand from the health and public services sector easily offset softer demand from its other end markets.", "Second, Accenture CEO Julie Sweet noted during last quarter's ", ' that the crisis "immediately widened the gap" between the technological leaders and laggards. Sweet noted Accenture was seeing the "leaders doubling down on their investments, while the laggards recognize the speed to accelerate the pace of their transformation." Sweet also declared that the company was "seeing even more significant growth post-COVID across industries" in transitions to cloud infrastructure platforms like ', ' Web Services and ', '\xa0Azure.', 'Those improving market conditions explain why Accenture offered such a clear outlook for the rest of the year when\xa0several of its peers, including IBM, declined to provide any forward guidance.', "Wall Street expects Accenture's revenue and earnings to grow\xa05% and 6%, respectively, next year. However, the stock isn't cheap at nearly 30 times forward earnings, and its forward yield of 1.4% won't attract too many dividend investors. By comparison, IBM trades at just 11 times forward earnings and pays a forward yield of 5.2%.", "Accenture's stock should generate stable gains for the foreseeable future since it's well insulated from the macro headwinds and it benefits from the secular growth of the cloud market, but its valuation could limit its upside potential. Accenture's stock remains a safe investment even as it hovers near its historic highs, but investors shouldn't expect it to blast off anytime soon.", 'When investing geniuses David and Tom Gardner have a stock tip, it can pay to listen. After all, the newsletter they have run for over a decade, ', ', has tripled the market.*', 'David and Tom just revealed what they believe are the ', " for investors to buy right now... and Accenture wasn't one of them! That's right -- they think these 10 stocks are even better buys.", '\xa0', '\xa0', 'The views and opinions expressed herein are the views and opinions of the author and do not necessarily reflect those of Nasdaq, Inc.', "Founded in 1993 in Alexandria, VA., by brothers David and Tom Gardner, The Motley Fool is a multimedia financial-services company dedicated to building the world's greatest investment community. Reaching millions of people each month through its website, books, newspaper column, radio show, television appearances, and subscription newsletter services, The Motley Fool champions shareholder values and advocates tirelessly for the individual investor. The company's name was taken from Shakespeare, whose wise fools both instructed and amused, and could speak the truth to the king -- without getting their heads lopped off."]|None
2|This Stock Could Be 2020's Best Profit Opportunity|['The damage from the coronavirus pandemic has extended far and wide, and industrial software company ', ' ', " has certainly not been immune. That said, there's a strong argument that its long-term growth prospects will actually be enhanced in the aftermath of the pandemic. If this thesis is correct, then the company could be significantly undervalued at its current price. Let's look at the investment case for PTC.", 'To understand why PTC is such an interesting stock, you have to look at the medium-term growth expectations outlined by management earlier in 2020. For reference, management characterizes its traditional computer aided design (CAD) and product life-cycle management (PLM) as being its core product offerings. Meanwhile, its ', ' (IoT) and augmented reality (AR) products are its growth offerings.', 'Image source: Getty Images.', "The key argument here is that PTC's core offerings, CAD and PLM, are obviously being hurt in the near term, but interest (and ultimately the rate of adoption) for its IoT and AR solutions is being enhanced by the pandemic. As you can see below, PTC's growth products (IoT and AR) aren't the key drivers of revenue and profitability ", ", but their growth rate will ensure that they will be in a few years' time. ", 'PTC Offering', '2019 Revenue', '2024 Estimated', 'Compound Annual Growth Rate 2019-2024', 'Competitors', 'CAD', '$5.1 billion', '$7.5 billion', '8%', 'PLM', '$1.9 billion', '$2.7 billion', '7%', 'Dassault, Siemens, Autodesk, ', 'IoT', '$2 billion', '$6.5 billion', '26%', ', SAP, Oracle, ', ', Siemens', 'AR', '$500 million', '$5 billion', '60%', "RE'Flekt, Librestream, Upskill, Scope", 'Data source: PTC presentations.', "Demand for CAD solutions is tied to the willingness of customers to invest in new products or projects that need CAD software for design. PLM software allows customers to manage the life cycle of a product from creation (using CAD) to production, use, and ultimately disposal. It's an exciting market in itself, not least because the adoption of internet-enabled devices and greater analytics capability is improving the efficacy of PLM software.", "Turning to the growth products, IoT product demand will improve with growth in the adoption of the digital factory. In a nutshell, PTC's IoT solutions connect a company's physical assets with the digital world. Through the use of web-enabled devices and advanced analytics, the physical asset (say, a gas turbine) can be better monitored and serviced. Meanwhile, AR allows technicians to access real-time information and service assets without even being present.", "There's no way to sugarcoat matters: PTC is also suffering from the pandemic. Going back to first-quarter earnings, management had expected full-year average recurring revenue (ARR) to be in the range of $1.27 billion to $1.3 billion and adjusted EPS of $2.15 to $2.65. But the decline in the economy has caused a reduction in expectations in ARR to $1.2 billion to $1.3 billion and adjusted EPS of $2.20 to $2.35.", 'The decline in expectations might not seem like much, but during the recent ', ' CEO Jim Heppelmann outlined that the pandemic and production shutdowns had caused customers to push out orders, and bookings were down 20% in the third quarter.', 'Engineers working on an augmented reality model. Image source: Getty Images.', 'But there are three reasons the long-term growth prospects for IoT and AR are being strengthened in the current environment. First, the pandemic heightened awareness of the benefit in being able to monitor, guide, and service assets remotely using IoT and AR technology.', 'Second, the supply chain issues that many companies have suffered during the pandemic will encourage them to digitize their operations. For example, during the ', ', Heppelmann outlined how medical companies had expanded "their smart, connected product deployments, enabling them to remotely monitor and service their product fleet seamlessly despite the operational challenges caused by the pandemic."', 'Third, a combination of the pandemic and the ongoing trade war is seen as encouraging ', '. If this takes place, then automation and digitization are likely to be a large part of it because companies will seek to offset the increased labor costs implied by moving production from China.', 'During the company\'s investor day presentations in 2019, management laid out a range of scenarios for the 2019-2024 period, from "recession" to "optimist," and implied free cash flow (FCF) in 2024 from $700 million to $900 million. The low end puts PTC at 14.1 times FCF in 2024 and the high end at 11 times. To put these figures into context, the company\'s current trailing twelve month FCF is around $200 million, so clearly PTC is a stock being bought for its growth prospects rather than its current valuation.\xa0 ', "While there obviously has been a recession since those forecasts were made, there's reason to believe that PTC's growth products (IoT and AR) will see a step up in growth after the pandemic is over. As such, it's reasonable to expect PTC will hit a FCF figure somewhere in the $700 million to $950 million range in 2024. Even the low end would leave it very attractively priced for a business with very strong long-term growth prospects.", 'When investing geniuses David and Tom Gardner have a stock tip, it can pay to listen. After all, the newsletter they have run for over a decade, ', ', has tripled the market.*', 'David and Tom just revealed what they believe are the ', " for investors to buy right now... and PTC wasn't one of them! That's right -- they think these 10 stocks are even better buys.", '\xa0', '\xa0', 'The views and opinions expressed herein are the views and opinions of the author and do not necessarily reflect those of Nasdaq, Inc.', "Founded in 1993 in Alexandria, VA., by brothers David and Tom Gardner, The Motley Fool is a multimedia financial-services company dedicated to building the world's greatest investment community. Reaching millions of people each month through its website, books, newspaper column, radio show, television appearances, and subscription newsletter services, The Motley Fool champions shareholder values and advocates tirelessly for the individual investor. The company's name was taken from Shakespeare, whose wise fools both instructed and amused, and could speak the truth to the king -- without getting their heads lopped off."]|None
3|3 Top Tech Stocks to Buy in September|["fter a terrible market meltdown in March, U.S. stock indices have come roaring back and are making new all-time highs. With the economy overall still down in the dumps due to COVID-19, it's the digital economy that's largely responsible for the rally.\xa0", "Given how quickly many stocks have recovered, some investors are now hitting the pause button. But whether you're just now jumping aboard the market recovery or looking to add to existing stocks, three of our Fool.com contributors think ", ', ', ', and ', ' are top tech stocks to buy in the month of September.', '\xa0', 'While many tech stocks have gotten a boost in recent months during the pandemic, not all have fared so well. Faced with a cash crunch, many organizations have had to decide which IT services are absolutely necessary and which can be purchased later. For Anaplan, some of the deals it was working on early in 2020 were reportedly getting categorized as the latter, and the cloud software outfit forecast a sharp slowdown in growth -- from 37% in the first quarter down to a forecasted 22% rate for the second quarter (the period ended July 31, 2020). \xa0', "Actual results ended up being far better, with Q2 total revenue increasing 26%, including a 32% increase in subscription sales to $97.1 million. Adjusted operating losses also narrowed to negative 9% compared to nearly negative 20% a year ago, as the small firm continues to get more efficient as it adds more users. Full-year guidance was also put back into place, which calls for at least 22% growth after Anaplan's excellent ", ' in 2019.', 'Though its trajectory has slowed compared to last year, Anaplan is still picking up new customers and adding new users at the companies already subscribed to its service. As the world tries to sort through the mess that is 2020, the ability to connect digital data with people across an organization -- especially given the remote work era we now live in -- is more important than ever. And as businesses move out of "damage control" mode, Anaplan\'s connected planning platform is again resonating. The stock began to rally back toward all-time highs last reached in early 2020 on the better-than-expected outlook.', "I'll admit I gambled a little when I first purchased Anaplan a few months ago after it reported its sharp pandemic-fueled slowdown. My hunch was and remains this cloud-based software company will regain its mojo as businesses get increasingly comfortable operating in a digital-first world (and discover they need some help getting their dispersed teams of employees to work together in this new environment). And though Anaplan competes against industry heavyweights like ", ', ', ', and ', ' in the enterprise resource-planning sandbox, the executive team has ', ". Share prices assume recent quarterly results will be repeated for some time and trade for 15 times expected one-year forward sales. But premium pricing is standard for high-growth and big-potential tech names like this. After assuaging fears in the second quarter, I'll be looking to add to my Anaplan position.", ' Semiconductor giant Intel is having a rough time in 2020. On top of the COVID-19 pandemic, the company is struggling to make its next-generation manufacturing process work. Critics see this situation as a prime opportunity for arch rival ', ' ', " to steal market share from Intel across the server, desktop, and notebook markets. Intel's stock has fallen 22% over the last three months, while AMD's shares rose by 64%, and the S&P 500 market barometer increased by 13%.", "This is not the end of Intel's storied road. The company is working around the delayed 7-nanometer manufacturing process with a new transistor-making technology that promises to boost the performance of the existing 10-nm platform by as much as 20%. Intel is exploring brand new markets, such as virtualized 5G radio systems and ", ". And above all else, Intel's board of directors posted a huge vote of confidence in the current strategy when they ", ' with a $10 billion authorization. Intel believes that its own stock is a great investment right now, and I agree.', "It's not often you get to buy a market-leading industry legend with temporary trouble but a clear path back to future growth, at the minuscule valuation of 9 times trailing earnings. But that's exactly what you get in Intel shares today.", ' With a lot of the ', " and software stocks going gangbusters recently, I'm going to go a little more obscure into the hardware world with Super Micro Computer as my top buy for September.", "Super Micro Computer is a $1.3 billion market cap company that makes server and storage systems for a diverse customer base worldwide. Admittedly, this isn't a high-flying growth business, but Super Micro's offerings should be in demand for years to come as enterprises need advanced, customized servers for cloud, artificial intelligence, and 5G/edge solutions.", 'Underpinning Super Micro Computer\'s resilience is its wide customer base and history of profitability. The company had over 850 different direct customers in 2019, with even more addressed through indirect resellers. In addition, the company has been profitable every year since its founding in 1993. The company also has a focus on "green" energy-efficient storage solutions, which helps customers save money on a total-cost-of-ownership basis.', "What's interesting about Super Micro in September is that while the stock has recovered strongly from the March sell-off, it also pulled back after its recent earnings report and is currently about 20% below recent highs. Super Micro Computer's September quarter guidance was a bit soft, and the company also took some extra one-time charges for the remediation of the prior accounting scandal from 2017, which may have soured some investors.", 'Yet on the positive side, those past accounting troubles are now firmly behind the company going forward. As to the soft guidance, it appears to be more of a pause after very strong buying in the first couple of quarters of 2020 as customers worried about supply disruptions.', "What's more, Super Micro announced a $30 million share-repurchase program, which it didn't have before. Super Micro Computer has about $200 million in net cash on its balance sheet and is profitable, so it definitely has the capacity to buy back shares. Moreover, the stock seems awfully cheap at this moment; it trades at about 16 times trailing 12-month earnings, but those earnings also include a bunch of one-time charges to remediate the accounting troubles from the past. Based on adjusted (non-", ') net income of $2.95 over the past 12 months, Super Micro is only trading at about 8.8 times adjusted earnings. When you factor in its excess cash, the stock is even cheaper from an ', ' perspective.', "The big tech trends of the next decade will require lots of server and storage solutions. When you combine Super Micro's bargain-basement valuation with these tailwinds, the stock looks awfully attractive as we head into September, especially compared with the rest of the technology sector.", '\nWhen investing geniuses David and Tom Gardner have a stock tip, it can pay to listen. After all, the newsletter they have run for over a decade, ', ', has tripled the market.*', 'David and Tom just revealed what they believe are the ', " for investors to buy right now... and Anaplan Inc wasn't one of them! That's right -- they think these 10 stocks are even better buys.", 'The views and opinions expressed herein are the views and opinions of the author and do not necessarily reflect those of Nasdaq, Inc.', "Founded in 1993 in Alexandria, VA., by brothers David and Tom Gardner, The Motley Fool is a multimedia financial-services company dedicated to building the world's greatest investment community. Reaching millions of people each month through its website, books, newspaper column, radio show, television appearances, and subscription newsletter services, The Motley Fool champions shareholder values and advocates tirelessly for the individual investor. The company's name was taken from Shakespeare, whose wise fools both instructed and amused, and could speak the truth to the king -- without getting their heads lopped off."]|None
4|AT&T Still Failing Up for Income|['I have a Mount Rushmore of failure for the last decade’s business leaders. It includes Virginia Rometty of ', ' (NYSE:', '), Brian Krzanich of ', ' (NASDAQ:', '), Jeff Immelt of ', ' (NYSE:', ') and Randall Stephenson of ', ' (NYSE:', '). And today we’re going to talk specifically about AT&T stock.', 'Source: Roman Tiraspolsky / Shutterstock.com\n\t\n', 'Their failures all resulted from putting dividends ahead of opportunity. ', '. His successor, John Stankey, gets a wireless duopoly, a failing cable franchise and the job of maintaining a dividend yielding 6.9%.', 'A 30-year government bond yields about ', '\xa0The yield represents the market’s skepticism that Stankey can keep that dividend going.', 'Stankey’s early moves are to cut costs at WarnerMedia. This is the former Time Warner, which Stankey headed after Stephenson paid $85.4 billion for it ', '.', 'New WarnerMedia head Jason Kilar, who formerly headed Hulu, has put Ann Sarnoff in charge of directing ', ' If Sarnoff’s name is familiar, her husband is the great nephew of legendary RCA chairman David Sarnoff. Her career includes stints at the BBC, Wall Street Journal, Nickelodeon, and the WNBA.', 'Sarnoff’s job is to spin straw Stephenson bought (instead of investing in cloud) into gold. HBO Max, its streaming service, has drawn just 4.1 million customers. It’s confusing and costs $15 a month. The ', ' (NYSE:', ') bundle of Disney+, ESPN+ and Hulu ', ' \xa0The price of ', '(NASDAQ:', ') new Peacock service starts at free.', 'In addition to his former bosses at Hulu, Kilar must also face ', ' (NASDAQ:', '), ', '\xa0(NASDAQ:', ') Prime and ', ' (NASDAQ:', ') YouTube, all of which are investing heavily while he’s forced to fall back.', 'Kilar’s fiefdom had a terrible, miserable, and ', ' HBO revenue was down 5.2%, and WarnerMedia revenue down 4%, as theaters closed. Turner revenue was down 12.4%, due to cable-cutting and lower advertising. During the second quarter alone 1.25 million customers ', ' their cable subscriptions.', 'Then there’s DirecTv, the satellite broadcaster. Stephenson ', ' for it five years ago. It’s now worth ', '.', 'Stankey is squeezing out costs everywhere. Since 2017, ', ' AT&T still had over $153 billion in long-term debt at the end of June.', ' (NASDAQ:', ') says AT&T is also running a game on cable programmers. It’s raising the price it pays itself for Turner networks while ', ' on networks it buys. As with the job cuts, these are actions Stephenson promised not to take before regulators.', 'The good news is AT&T Wireless, which helped AT&T earn ', ' during the quarter. The wireless unit has a shared monopoly with ', ' (NYSE:', ') and, now, ', ' (NASDAQ:', '). T-Mobile claims to have overtaken AT&T in market share but those claims are ', 'AT&T Wireless has a clear runway to 5G, a service it’s now turning on ', ' \xa0But Stephenson cut the unit’s capital budget this year by ', ' plowing the money into share buybacks under pressure from Elliott Management, which took a $3.2 billion stake in AT&T ', '.', 'After becoming AT&T CEO in 2007, Stephenson talked a lot about cloud, ', 'But he didn’t invest in it. Instead he poured money into dividends and invested in entertainment channels that were losing access to the market, because of the cloud. The new CEO even comes from that entertainment industry.', 'AT&T opened Aug. 11 with a market cap of $218 billion. That’s just $8 billion more than Netflix and barely one-fourth that of the smallest Cloud Czar, ', ' (NASDAQ:', '), which is worth $744.5 billion.', 'That’s why Stephenson belongs on the Mount Rushmore of fail. Hopefully Stankey can do better.', ' has been a financial and technology journalist since 1978. His latest book is ', ', essays on technology available at the Amazon Kindle store. Write him at ', ' or follow him on Twitter at ', '. As of this writing he owned shares in AMZN.', 'The post ', ' appeared first on ', '.', 'The views and opinions expressed herein are the views and opinions of the author and do not necessarily reflect those of Nasdaq, Inc.']|None
