id|title|text|date
5|IBM rolls out newest processor chip, taps Samsung for manufacturing|['International Business Machines Corp ', ' announced on Monday a new processor chip for data centers that it says will be able to handle three times the workload of its predecessor.', 'The IBM-designed Power10 chip will be manufactured by Samsung Electronics Co Ltd ', ' and is meant for use by businesses inside data centers, IBM said.', "The chip will use Samsung's 7-nanometer chip manufacturing process, which is similar to the 7-nanometer technology that Advanced Micro Devices Inc ", ' uses to have its chips made by Taiwan Semiconductor Manufacturing Co Ltd ', '.', 'Both IBM and AMD use outside chip factories to compete against Intel Corp, the dominant provider of central processor chips in data centers and one of the few players left that both designs and manufactures its own chips.', 'Intel recently said its next generation of manufacturing technology faces delays, which analysts believe will allow its rivals to gain market share.', "IBM has long focused on high-performance computing systems, with three of the world's top-ten fastest supercomputers using its chips. The company said Monday that the Power10 chip has been designed to be faster at artificial intelligence computing tasks than its predecessor, doing such work up to 20 times faster than its previous generation of chip.", '(Reporting by Stephen Nellis in San Francisco; editing by Diane Craft)', '((', '; (415) 344-4934;))', 'The views and opinions expressed herein are the views and opinions of the author and do not necessarily reflect those of Nasdaq, Inc.', "Reuters, the news and media division of Thomson Reuters, is the world’s largest international multimedia news provider reaching more than one billion people every day. Reuters provides trusted business, financial, national, and international news to professionals via Thomson Reuters desktops, the world's media organizations, and directly to consumers at Reuters.com and via Reuters TV."]|None
6|iShares Russell 1000 Value ETF Experiences Big Outflow|['Looking today at week-over-week shares outstanding changes among the universe of ETFs covered at ', ", one standout is the iShares Russell 1000 Value ETF (Symbol: IWD) where we have detected an approximate $164.8 million dollar outflow -- that's a 0.4% decrease week over week (from 301,300,000 to 299,950,000).  Among the largest underlying components of IWD, in trading today Danaher Corp (Symbol: DHR) is up about 0.1%, Philip Morris International Inc (Symbol: PM) is off about 0.9%, and International Business Machines Corp (Symbol: IBM) is lower by about 0.2%. ", ' \n\nThe chart below shows the one year price performance of IWD, versus its 200 day moving average:\n   \n', '\n   ', "\n\nLooking at the chart above, IWD's low point in its 52 week range is $84.11 per share, with $138.875 as the 52 week high point — that compares with a last trade of $122.01.  Comparing the most recent share price to the 200 day moving average can also be a useful technical analysis technique -- ", '.\n\n\n\n\t\t\n', "\n\nExchange traded funds (ETFs) trade just like stocks, but instead of ''shares'' investors are actually buying and selling ''units''.  These ''units'' can be traded back and forth just like stocks, but can also be created or destroyed to accommodate investor demand.  Each week we monitor the week-over-week change in shares outstanding data, to keep a lookout for those ETFs experiencing notable inflows (many new units created) or outflows (many old units destroyed).  Creation of new units will mean the underlying holdings of the ETF need to be purchased, while destruction of units involves selling underlying holdings, so large flows can also impact the individual components held within ETFs.\n\n", '\n', '\n', 'The views and opinions expressed herein are the views and opinions of the author and do not necessarily reflect those of Nasdaq, Inc.']|None
7|Dow Jones Surges as Boeing Reports Cancellations, IBM Signs Hybrid Cloud Deal, and American Express Eyes Kabbage|['The ', ' ', " was having another strong day on Tuesday, up 0.71% at 2:40 p.m. EDT and handily outperforming the other major U.S. stock indexes. In COVID-19 news, Russia announced that it had approved a vaccine and would begin inoculating teachers and medical workers this month. However, the effectiveness and safety of Russia's vaccine is unknown.", 'Helping drive ', "'s gain on Tuesday were ", ' ', ', ', ' ', ', and ', ' ', '. Boeing stock rose despite more 737 MAX cancellations, IBM stock jumped after the company signed a hybrid cloud deal, and American Express stock surged on reports of a potential acquisition.', 'Image source: Getty Images.', 'Airplane manufacturer Boeing lost 43 orders for its 737 MAX planes in July. Nearly 400 orders for the still-grounded plane have been canceled this year. ', ', but it may still be months before the planes are cleared to carry passengers.', 'On top of the cancellations, Boeing delivered just four airplanes in July, including two freighters and two 787 Dreamliners. The company delivered 19 planes in the same period last year.', "While Boeing is struggling to deliver planes to customers, demand for air travel is slowly recovering. The Transportation Security Administration (TSA) reported more than 830,000 passengers going through U.S. airport checkpoints last Sunday, the highest level since mid-March. While passenger volumes remain deeply depressed, they've increased by a factor of 8 from the lows reached in April.", 'Despite the cancellations, shares of Boeing were up about 4% by Tuesday afternoon.', 'IBM announced on Tuesday that it had signed a multi-year agreement with ', ' (CCEP) to move the Coca-Cola bottler to a hybrid cloud environment using Red Hat OpenShift and Red Hat Enterprise Linux. ', ' in a $34 billion deal in 2019, bolstering its hybrid cloud capabilities.', "Previously, IBM worked with CCEP to move one-third of its enterprise workloads from a dedicated U.S. data center to IBM Cloud in Europe. Under the new agreement, IBM will manage CCEP's hybrid cloud environment, which will include the use of IBM's public cloud.", 'IBM is far behind industry leaders ', 'Web Services and ', 'Azure in the public cloud market, but the company is betting that a hybrid cloud approach will resonate with its large enterprise customers. Shares of IBM were up about 1% by Tuesday afternoon.', 'Bloomberg reported late Monday that credit card giant American Express is in advanced talks to acquire Kabbage, an online small-business lender. American Express is already a leading provider of credit cards to small businesses.', "A deal could value Kabbage at $850 million, according to Bloomberg's sources, below a $1 billion private valuation achieved in 2017. Kabbage furloughed employees in March due to the pandemic, but it was able to participate in the Paycheck Protection Program and provide loans to more than 130,000 businesses.", 'Shares of American Express were up 3.2% by Tuesday afternoon on the news. If a deal is reached, it could be announced sometime this month.', 'When investing geniuses David and Tom Gardner have a stock tip, it can pay to listen. After all, the newsletter they have run for over a decade, ', ', has tripled the market.*', 'David and Tom just revealed what they believe are the ', " for investors to buy right now... and IBM wasn't one of them! That's right -- they think these 10 stocks are even better buys.", '\xa0', '\xa0', 'The views and opinions expressed herein are the views and opinions of the author and do not necessarily reflect those of Nasdaq, Inc.', "Founded in 1993 in Alexandria, VA., by brothers David and Tom Gardner, The Motley Fool is a multimedia financial-services company dedicated to building the world's greatest investment community. Reaching millions of people each month through its website, books, newspaper column, radio show, television appearances, and subscription newsletter services, The Motley Fool champions shareholder values and advocates tirelessly for the individual investor. The company's name was taken from Shakespeare, whose wise fools both instructed and amused, and could speak the truth to the king -- without getting their heads lopped off."]|None
8|With iBio at 4-Week Lows, Now May Be the Time to Buy|['The iBio (NYSEAMERICAN:', ') story has a lot of appeal. The Texas-based biotech company heavily promotes its FastPharming system for delivery of plant-based medical solutions including vaccines. Naturally, iBio joined the race for a novel coronavirus vaccine. That effort has resulted in massive jumps and considerable volatility for IBIO stock.', 'Source: Shutterstock.com\n\t\n', 'After starting 2020 as a penny stock, by mid-July IBIO had spiked by over 2,800% with a $6.41 close on July 20. Since then, shares have been on a downhill trajectory, closing at $2.60 last week.', 'Does that make this a good time to jump on the iBio bandwagon? Or is IBIO back on its way to penny stock territory?', 'The coronavirus pandemic has made biotech companies stock market superstars in 2020. With so much riding on a successful vaccine, virtually any company actively working on one has seen its stock take off.\xa0', 'Texas-based iBio joined the fray, but its story made it stand out from many competitors.', 'Central to the iBio appeal is its FastPharming production system. This is a 130,000-square-foot facility that features vertical farming and automated hydroponics for maximum production.', 'If that sounds a little high-tech and different from the usual biotech approach, it’s probably no surprise that the facility was built with DARPA (U.S. Defense Advanced Research Projects Agency) funding.', 'The growth of IBIO stock ', '. The company announced a partnership with China’s CC Pharming Ltd. that would see the two companies collaborate on a Covid-19 vaccine. The effort would leverage CC Pharming’s expertise and iBio’s FastPharming to rapidly scale up commercial production of any vaccine. In the release, CC Pharming’s Chief Science Officer Kevin Wang said:', '“This is an important collaboration to develop plant-derived vaccine strategies for the emerging coronavirus outbreak here in China, and around the world. iBio’s capabilities will enhance our ability to rapidly scale-up vaccine candidate production in effort to combat the 2019-nCoV virus’ threat to global health.”', 'This announcement kicked off a six-month run that saw IBIO stock rocket from a low of 22 cents a share on Jan. 15 to a close of $6.41 on July 20.', 'The biggest boost for iBio shares took place at the end of June and lasted nearly four weeks. It began with the announcement of a second vaccine candidate. At this point, the company had two horses in the race, doubling its chances of success. In addition, iBio ', ', noting:', '“… our plant-based system avoids resource-intensive scale-up challenges associated with traditional manufacturing approaches so that we should be able to more rapidly produce high-quality material for hundreds of millions of doses upon regulatory clearance.”', 'On June 24, iBio announced it had been chosen by IBM (NYSE:', ') for ', '. This gives iBio free access to IBM’s Watson technology at no cost for 18 months to aid in managing vaccine data.', 'The frenzy over the increased odds of a successful vaccine, IBM’s assistance, plus the company’s ability to quickly ramp up production in huge quantities drove IBIO to a 345% gain in just four weeks.\xa0', 'Since that July 20 peak, it’s been downhill for IBIO. At the start of the week the company released an ', '. Results are positive, but it is still in the pre-clinical trial stage.', 'There are many biotech companies hot in pursuit of a Covid-19 vaccine. At this point, as clinical trials progress, some are clearly closer to the prize than others. For example, Noravax (NASDAQ:', ') has recently been making headlines after ', '.\xa0', 'With some competitors entering Phase 1, Phase 2 and Phase 3 clinical trials — all of which involve human subjects — iBio is falling behind. However, the first to market is not necessarily the sole winner and may be supplanted by a more effective vaccine.', 'Don’t count iBio out. If its efforts succeed, FastPharming is going to be a huge advantage when it comes to meeting demand.', 'If you want to jump on the Covid-19 vaccine bandwagon, iBio shares are cheap and the potential for growth is considerable. But be prepared for a bumpy ride, with news releases — from both iBio and competing biotech companies — driving spikes and drops in IBIO stock until the vaccine race concludes.', 'As of this writing, Brad Moon did not hold a position in any of the aforementioned securities.', 'The post ', ' appeared first on ', '.', 'The views and opinions expressed herein are the views and opinions of the author and do not necessarily reflect those of Nasdaq, Inc.']|None
9|Technology Sector Update for 08/17/2020: XRX, HUYA, DOYU, IBM, XLK, SOXX|['Technology stocks were trading higher premarket Monday as the Technology Select Sector SPDR ETF (', ') was advancing by 0.50% and the Semiconductor Sector Index Fund (SOXX) was recently climbing by 0.70%.', 'Xerox (', ') was more than 1% higher after saying it intends to start an add-on offering of 5% senior notes that are due in 2025 and 5.5% senior notes due in 2028.', 'HUYA (', ') and DouYu International Holdings (', ") announced in separate Monday statements their respective boards' establishment of special committees that will evaluate the proposed all-stock merger between the companies. HUYA was up more than 2%, while DouYu was rallying past 1% recently.", 'International Business Machines (', ') was advancing 0.5% after it launched its newest processor chip, called IBM Power10.', 'The views and opinions expressed herein are the views and opinions of the author and do not necessarily reflect those of Nasdaq, Inc.']|None
